occurance,transcription,App_TAG
1,i have not received my notification as to my claim for my tax benefit on my c_c_b,Enquire_CCB
1,my parenting payment suspension,Enquire_Parenting
1,new family income estimate,Update_FamilyIncomeEstimate
1,finishing work,Employment
1,cancel a lump_sum advance payment,Advance
1,didn't get paid my full amount,Enquire_Payments
1,port fortnightly earnings,Report_Earnings
2,enquiry about rent assistance,RentAssistance
1,add a second child onto my day_care,Enquire_CCB
1,i need to report my earnings operator,Report_Earnings
1,to enquire about a parenting payment,Enquire_Parenting
1,it's a payment family assistance,Enquire_Payments
1,the allowance for children in school,Enquire_CCB
1,i wish to apply for the advance payment,Advance
1,just wanna speak to a customer servicer,Request_Operator
1,new circumstances,Change_Circumstances
1,for registration of connor gray at vacation,Enquire_CCB
1,income assessment estimate sorry,Update_FamilyIncomeEstimate
1,to find out if i'm entitled to assistance for a specialist appointment,Appointment
1,provider number for outside school hours care,Enquire_CCB
1,child_care benefit c_r_n number,Enquire_CCB
1,johnny,Garbage
1,new earnings,Report_Earnings
1,three five eight three five seven nine two nine s,Enquire_Vague
17,declare earnings,Report_Earnings
1,child_care summary,Enquire_CCB
1,updating income estimate for two thousand seven two thousand and eight,Update_FamilyIncomeEstimate
1,i have a discrepancy in my family allowance,Enquire_Payments
1,the estimate of income,Update_FamilyIncomeEstimate
1,in reference to my concession card health_care card,Cards
1,i need to report my hours of work,Report_Earnings
1,i have to report today,Report_Earnings
1,notification of non tax return lodgment,TaxReturn
7,family income update,Update_FamilyIncomeEstimate
4,payment information payment information,Check_Payments
1,for my tax benefit in july,Enquire_LumpPayment
1,i need to let you know that i have started work again,Employment
1,my wife is just had a baby,Maternity
1,applying for child_care rebate,ChildCareRebate
1,to check on an advance payment,Advance
1,enquiring about single parenting pension,Enquire_Parenting
1,enquiring about assets,IncomeReportingStatement
1,the reason for the call is child_care benefit,Enquire_CCB
1,because my son has started full casual employment and i need my family assistance payment reviewed,Enquire_FamilyAssistance
1,about six hundred dollar lump_sum,Enquire_LumpPayment
1,i want to find out about going back to work and how it affects my assistance,Employment
1,add a deduction,Deductions
1,three hundred dollar advance payment,Advance
1,jobs education training child_care fee assistance,Enquire_Jet
1,assistance loan,Advance
1,sole parent payment,Enquire_Parenting
1,child_care allowance enquiry,Enquire_CCB
1,try an assistant,Request_Operator
1,they've cancelled my parenting payment,Enquire_Parenting
2,lump_sum payments,Enquire_LumpPayment
1,to speak to kim regarding a meeting that we had last week regarding my family or sorry my business income as i've been off work for the last four months due to an accident,Appointment
1,i need to confirm if i owe any money due to the child support agency it wasn't being paid enough and they told me to check with yous guys as to whether i will end up with a debt,Debt
2,my tax,Enquire_Tax
1,talk to youth services,YouthAllowance
1,report for june twenty eighty,Report_Earnings
1,just checking my f_t_b payments,Check_Payments
1,income hearing,Garbage
1,a family tax benefit part_a,Enquire_FTB
1,advise of return to work,Employment
1,for my payment,Check_Payments
1,family payment has been cancelled,Enquire_FamilyAssistance
5,maintenance,ChildSupport
1,i need to talk to somebody about change of address and child_care benefit percentage,PersonalDetails
1,i need my taxable income for the oh six oh seven financial year,PaySummary
1,need the operator,Request_Operator
1,large family supplement,Enquire_FamilyAssistance
10,a loan,Advance
1,disbursement date of six hundred dollar family tax benefit,Enquire_LumpPayment
1,report my earnings in the last fortnight,Report_Earnings
1,i want to find about find out about child_care benefits a child_care benefit letter that i received,Enquire_CCB
1,why my payments not in the bank,Enquire_Payments
2,started work,Employment
1,about receiving payments the children parent's support,Enquire_Parenting
1,enquiry about when money will be going into the bank six hundred dollars per child,Enquire_LumpPayment
1,put my daughter back on my family assistance,Enquire_FamilyAssistance
1,checking a claim,Claim
1,parenting payments not deposited,Enquire_Parenting
1,planning pregnancy,Enquire_FamilyAssistance
1,loan advance payment,Advance
1,family allowance lump_sum,Enquire_LumpPayment
1,enquiry about study,Education
1,can i speak to someone you,Request_Operator
5,line,Garbage
2,self_service options,GoTo_SelfService
1,i wanna find out my entitlements,Enquire_FamilyAssistance
1,i'm calling for the family tax benefits supplement,Enquire_FTB
1,i'm enquiring about extra money into my account could be the family loan payment in advance just,Advance
1,find out about immunizations,Immunisation
1,i need to talk to someone about updating my child's child_care benefit,Enquire_CCB
1,i need to add a vacation care,Enquire_CCB
1,child_care benefit child_care benefit,Enquire_CCB
1,change in banking details,PersonalDetails
1,supplement for each child,Enquire_FamilyAssistance
1,to claim for family assistance and medicare for new_born new_born child,Claim
1,increasing the estimate family payment,Update_FamilyIncomeEstimate
1,inconclusive mail,Respond_Correspondence
1,i want to inform you that we are back in the country and also to say that i have a new new daughter,Overseas
1,just ringing to check_up on my tax and my reference number is,Enquire_Tax
1,update financial income details,Update_FamilyIncomeEstimate
1,i'd like to find out about my parenting payment,Enquire_Parenting
1,about lump_sum,Enquire_LumpPayment
1,money owing,Enquire_Payments
1,end of year tax payment,Enquire_LumpPayment
1,i need to lodge non tax return,TaxReturn
2,i wanna find out about my payment,Check_Payments
1,the one of family payment,Enquire_Payments
2,registration,Claim
1,child_care benefits child_care benefits child_care benefits,Enquire_CCB
1,i wanna find out about the family large supplement,Enquire_FamilyAssistance
2,enquiry about parent payment,Enquire_Parenting
1,need to update my family estimate,Update_FamilyIncomeEstimate
1,i want to speak to a person,Request_Operator
1,update and find out about my earnings,Report_Earnings
1,change of address and living arrangements,PersonalDetails
1,to update my estimate earnings,Update_FamilyIncomeEstimate
1,regarding the cancellation of your family assistance,Enquire_FamilyAssistance
1,want to change my postal address,PersonalDetails
1,know when i get my money for the tax benefit a,Check_Payments
1,government money,Enquire_FamilyAssistance
1,each payments,Enquire_Payments
1,parenting payment for enquiry,Enquire_Parenting
3,submit the earnings,Report_Earnings
1,detail,Garbage
1,changes in my parenting payment,Enquire_Parenting
1,change of work address,PersonalDetails
1,advise on family tax benefit,Enquire_FTB
1,query about a carer payment,Carers
1,a five hundred dollar advance,Advance
1,i was enquiring to see whether i had to ring up and say i don't have to lodge a tax return for the family allowance i think it's just over six hundred dollars per child thing,TaxReturn
1,the government payment,Enquire_FamilyAssistance
1,enquiry on parenting payment and group certificate,PaySummary
1,i want to enquire for family allowance please,Enquire_FamilyAssistance
1,wanting to report my family earnings,Update_FamilyIncomeEstimate
2,need,Garbage
1,can i talk to the operator,Request_Operator
1,about a five hundred dollars that pension that's i receiving it's just a query,Advance
1,just future payments,Check_Payments
1,enquiring about part_b,Enquire_FTB
1,talk to talk to an operator,Request_Operator
1,to report claim with child support agency,ChildSupport
5,address change,PersonalDetails
1,family assistance claims,Claim
1,to find out about tax end of financial year supplement,Enquire_LumpPayment
1,i would like to speak to a human please,Request_Operator
2,the amount of my next payment,Check_Payments
1,i have to prove the amount of care i have my son for,Enquire_SharedCare
1,to find out how much i earn next financial year i don't know,Enquire_FamilyAssistance
1,family assistance tax benefit payment,Enquire_FTB
1,one of family payment,Enquire_Payments
1,request an advance,Advance
1,somebody called me yesterday and i missed the call,Respond_Correspondence
1,i would like to talk with some operators customer service operators,Request_Operator
1,serena russo appointment,Appointment
1,changing payment times from yearly to weekly or fortnightly,Enquire_Payments
1,i want to know when my payment will be,Check_Payments
1,family tax benefit payment options,Enquire_FTB
1,applying for the loan,Advance
4,families,Enquire_FamilyAssistance
1,my earnings please,Report_Earnings
1,family advancement payment,Advance
1,for the lump_sum,Enquire_LumpPayment
2,six hundred bonus,Enquire_LumpPayment
1,i wanna talk to someone about my payment,Enquire_Payments
1,employer details and verification request service update,Employment
1,to tell you i don't need to do a tax file returns,TaxReturn
1,i would like to get a new account please,Enquire_FamilyAssistance
3,enquiry about child_care benefit,Enquire_CCB
1,it's about my family tax benefit,Enquire_FTB
1,an enquiry about the government payment,Enquire_Payments
1,find out how much i get per child with the government money,Enquire_FamilyAssistance
2,i wanna report my earnings,Report_Earnings
1,the government money at tax time,Enquire_LumpPayment
1,parenting payment income,Enquire_Parenting
1,i wanna know why i'm getting more money than i should be,Enquire_Payments
1,change family benefit,Enquire_FamilyAssistance
1,family family assistant supplement,Enquire_FamilyAssistance
1,lodging family tax benefit,Enquire_FTB
1,i need to report of my earning,Report_Earnings
1,i want to find out the new baby bonus,Maternity
1,query about my payment,Enquire_Payments
5,working,Employment
1,last centrelink payment,Check_Payments
1,suspend a centre_pay payment,Deductions
1,to ask about my tax,Enquire_Tax
1,two thousand and seven taxable income,PaySummary
1,my partner is moving in with me,Change_Circumstances
4,for my parenting payment,Enquire_Parenting
1,processing rent certificate,RentAssistance
1,to talk about a letter i got in the mail,Respond_Correspondence
2,self_service payment details,Check_Payments
1,want to find out about tax,Enquire_Tax
1,child_care support,Enquire_CCB
1,about my family assistance payment,Enquire_Payments
1,i would like to apply for jet,Enquire_Jet
1,enquiring about annual family payment,Enquire_Payments
1,percentages,Enquire_CCB
1,for loan,Advance
5,care rebate,ChildCareRebate
38,update my family income estimate,Update_FamilyIncomeEstimate
1,to check_up on my payment for study leave,Check_Payments
1,enquiry of forms,IncomeReportingStatement
1,i need to speak with a operator,Request_Operator
1,about outstanding amount to pay,Debt
1,the six hundred dollar per child,Enquire_LumpPayment
1,checking how much i get paid on monday,Check_Payments
1,report non lodgement,TaxReturn
1,i need to report my arrive from overseas,Overseas
1,i'm ringing up about my double endowment and also about the bonuses paid being paid for supporting parents,GeneralBonus
1,i wanna check my maternity allowance payment,Maternity
1,it's a letter regarding that i received from centrelink,Respond_Correspondence
1,i'm just calling to apply i want a form for my son who's nineteen years old now,IncomeReportingStatement
1,i needed to speak to operator operator,Request_Operator
1,just wanted to know when i'm getting my lump_sum,Enquire_LumpPayment
22,claim,Claim
1,letting you know my taxable income for last year,PaySummary
27,reporting my earnings,Report_Earnings
1,i want to check on the viability of applying for a youth allowance for my son,YouthAllowance
1,i want to enquire about income estimate,Update_FamilyIncomeEstimate
2,i need to change my details,PersonalDetails
2,enquiry on the family tax benefit part_a,Enquire_FTB
1,report income operator,Report_Earnings
1,registering birth of child the maternity allowance,Maternity
1,i just want some information,Enquire_Vague
2,want to update my income estimate,Update_FamilyIncomeEstimate
1,find out about family family tax benefits,Enquire_FTB
2,account statement,IncomeReportingStatement
1,family income income estimate,Update_FamilyIncomeEstimate
1,my money's not in the bank,Enquire_Payments
1,about family tax benefits,Enquire_FTB
1,for the,Garbage
1,questioning a letter i received,Respond_Correspondence
1,apply for family tax benefit advance,Advance
3,earnings report,Report_Earnings
41,talk to an operator,Request_Operator
1,to find out why my family assistance has been cut off,Enquire_FamilyAssistance
1,just some payment details,Check_Payments
91,family assistance payment,Enquire_Payments
1,i need to apply for my youth allowance,YouthAllowance
1,operator i wanna talk to an operator,Request_Operator
1,to update my parenting payment,Enquire_Parenting
2,update my estimate income,Update_FamilyIncomeEstimate
1,change direct debits,Deductions
1,to update salary combined income for child_care benefits,Update_FamilyIncomeEstimate
1,i need to change my bank account,PersonalDetails
1,updated c_c_b,Enquire_CCB
1,the food grant,OutOfDomain
1,had a letter regarding my child_care benefit benefit claim saying that the approved care use is not shown on your list,Claim
1,my jet child_care fees,Enquire_Jet
1,i need to check on my income and asset form,IncomeReportingStatement
1,change of income details,Update_FamilyIncomeEstimate
1,i'm after a statement of child_care,Enquire_CCB
1,to find out about what's going on,Enquire_Vague
1,customer service,Request_Operator
1,i need to nominate a day_care centre,Enquire_CCB
1,what my payments will be,Check_Payments
1,i wanna find out about a parenting payment,Enquire_Parenting
1,calling about family assistance money,Enquire_FamilyAssistance
1,the government bonus,GeneralBonus
1,family payments enquiry,Enquire_Payments
1,to place,Garbage
1,i wanted to know when my tax is coming back,Enquire_FamilyAssistance
1143,self_service,GoTo_SelfService
1,need to update family income estimates,Update_FamilyIncomeEstimate
1,just wondering what my what kind of benefit my daughter entitled to get,Enquire_FamilyAssistance
1,children's child_care services,Enquire_CCB
1,i need a statement of benefit,IncomeReportingStatement
1,i would like to an operator,Request_Operator
1,need to find out when i'll be receiving my tax,Enquire_Tax
1,to tell you my income for the fortnight,Report_Earnings
7,child_care rebates,ChildCareRebate
1,to find out about payments,Enquire_Payments
1,just to enquire my my my payment,Enquire_Payments
7,report,Report_Earnings
1,my money wasn't put in today,Enquire_Payments
1,i wanted to know about the exact amount you're sending me,Check_Payments
1,i would like to update my income,Update_FamilyIncomeEstimate
1,need to change my report earnings,Report_Earnings
1,supply reference number,Enquire_CCB
2,i want to change my account,PersonalDetails
4,i want to speak to operator,Request_Operator
1,cancel centre_pay form,Deductions
1,advance sum payment on family tax benefit,Advance
6,a question,Enquire_Vague
1,a query about deductions from a family payment,Deductions
1,to update my information on child_care benefit,Enquire_CCB
1,i want to know if i'm getting a group certificate,PaySummary
1,i want to speak to customer service cause i'd like to to get my statement of the centrelink payment thank you,PaySummary
1,renewing a health_care card,Cards
1,the family tax benefit money,Enquire_FTB
1,update of payment,Enquire_Payments
1,i just wanna know what our combined income is,Update_FamilyIncomeEstimate
2,add child_care,Enquire_CCB
1,just to enquire about my payment,Enquire_Payments
25,payment advance,Advance
7,lump_sum advance payment,Advance
2,payment summary for tax,PaySummary
1,enquiring about the advance payment of the i think it's the family tax part_a or b,Advance
1,family assistance family tax benefit part_a,Enquire_FTB
1,i want to make a claim,Claim
1,our family payment and c_c_b,Enquire_CCB
1,advance repayment or advance payment,Advance
1,needing a letter,Respond_Correspondence
2,hours,Report_Earnings
1,want to find out my payment,Check_Payments
1,about family payments,Enquire_Payments
1,family assistance changes,Enquire_FamilyAssistance
1,six hundred dollar bonus per child,Enquire_LumpPayment
1,mediation,OutOfDomain
1,i need to change my payment information,Enquire_Payments
13,operator assistance,Request_Operator
1,percentage rate for child_care,Enquire_CCB
1,enquire about a advance payment line,Advance
1,income increase,Update_FamilyIncomeEstimate
1,for an estimate of family payment difference in wage,Update_FamilyIncomeEstimate
1,to enquire about payments,Enquire_Payments
1,child_care benefit and taxable income for two thousand seven,PaySummary
1,e_b_t,PersonalDetails
1,i would like to get an extension on my rent certificate letter,RentAssistance
1,need to know about my payments,Check_Payments
2,looking for work,Employment
1,to put in a pay docket amount report,Report_Earnings
1,i want to make a new_born child claim for family assistance and medicare,Claim
10,newstart allowance,NewStart
1,budget,Announcement
1,the yearly bonus of six hundred dollars to let you know that i don't have a tax file number,Enquire_LumpPayment
1,i want to add a child_care centre,Enquire_CCB
1,a client service officer,Request_Operator
1,need to in extent extend a date for return of a form,IncomeReportingStatement
1,to fill in this application for family assistance,Claim
4,fortnightly income report,Report_Earnings
1,i want to check my child_care benefits,Enquire_CCB
1,check payment amount,Check_Payments
1,i need to review my child_care benefit percentage,Enquire_CCB
2,business details,PersonalDetails
1,i'm ringing about loan,Advance
1,i want to find out about my daughter's payment,Enquire_FamilyAssistance
1,enquiry about an application,Claim
1,when is the part pay of the tax payment being paid,Check_Payments
1,family payments six hundred dollar per child,Enquire_LumpPayment
1,just a general query,Enquire_Vague
1,speak to an operator about advance,Advance
1,payment deductions,Deductions
1,enquiring whether i'm entitled to a health_care card,Cards
1,report earnings speak to operator,Report_Earnings
1,report income family payment,Enquire_Payments
1,i have not lodged a tax return and need an extension,TaxReturn
1,working credit balance,Enquire_Payments
1,parent lump_sum payment,Enquire_LumpPayment
1,i'm ringing to give you an estimate of my wage,Update_FamilyIncomeEstimate
1,enquiry about family assistance child_care benefit,Enquire_CCB
1,f_t_b payments,Enquire_FTB
1,the one thousand dollar carer payment,Carers
1,i'm enquiring about family assistance,Enquire_FamilyAssistance
2,need child_care provider,Enquire_CCB
1,sole parent enquiry,Enquire_Parenting
1,the seven percent rebate claim for child_care,ChildCareRebate
1,i want to stop my parenting payment,Enquire_Parenting
1,to apply for parenting payment partnered,Claim
1,change my centre_pay,Deductions
1,grants not found,Enquire_Payments
1,child_care benefit and family assistance,Enquire_CCB
1,i'm just wondering whether i'm entitled to some family assistance,Enquire_FamilyAssistance
1,update my family assistance payment,Enquire_FamilyAssistance
1,family tax b,Enquire_FTB
1,family tax benefit did i get paid,Enquire_FTB
1,have no been paid,Enquire_Payments
1,report income details,Update_FamilyIncomeEstimate
1,future payment self_service,Check_Payments
1,i need to speak to a human,Request_Operator
1,pension's two hundred list,Enquire_LumpPayment
1,my family assistance payment family tax payment part_a cause my income's gone up so i need to ask a few,Enquire_FTB
1,i need to enquire about my advance on my family payment,Advance
106,future payment,Check_Payments
1,update my income figures,Update_FamilyIncomeEstimate
1,information about family payment,Enquire_Payments
1,i need to provide details for the new_born child claim for family assistance and medicare,Claim
1,i have to make an appointment for family tax benefit and parenting payment single parent,Appointment
1,notifying of changes,Enquire_FamilyAssistance
1,i'm supposed to fill in a and send back by a certain date but i'm in sydney children's hospital with my son,Respond_Correspondence
1,one_off payment of six hundred dollars,Enquire_LumpPayment
1,talk to an operator about family tax benefit,Enquire_FTB
1,the income has changed income amount has changed,Update_FamilyIncomeEstimate
1,reporting a income,Report_Earnings
1,want to check what my child_care benefit is,Enquire_CCB
1,my i've got two daughters for collecting your family assistance allowance one daughter has now gone to work and i want to cancel one daughter's payment,Enquire_FamilyAssistance
1,private family payment,Enquire_Payments
1,i wanna change the the circumstances of my family assistance payment,Change_Circumstances
1,parenting enquiry,Enquire_Parenting
1,every two weeks i call for have my earnings,Report_Earnings
2,i need some information,Enquire_Vague
1,family tax benefit two thousand five two thousand six,Enquire_FTB
1,i'm trying to register a new_born,Claim
1,how to claim again for family assistance,Claim
1,just payment,Enquire_Payments
1,upgrading my family my income,Update_FamilyIncomeEstimate
1,new deductions,Deductions
1,to update the provider number,Enquire_CCB
22,to report earnings,Report_Earnings
1,i'm calling about group certificates,PaySummary
1,provide my income details,Update_FamilyIncomeEstimate
1,general enquiry about pension and my current working,Enquire_FamilyAssistance
1,enquiring debt,Debt
1,register new_born baby,Claim
1,enquiry about a large sum advance,Advance
1,i need to quote my child_care provider number,Enquire_CCB
1,payments for storm damage,Announcement
2,family payment query,Enquire_Payments
1,claiming family assistance just had a baby,Claim
53,change of circumstances,Change_Circumstances
1,i have a letter that i believe is incorrect,Respond_Correspondence
2,yearly payment,Enquire_LumpPayment
1,c_c_b fees,Enquire_CCB
1,enquiry about the child_care benefit percentage rate,Enquire_CCB
1,medicare family assistance claim for family assistance,Claim
1,when am i entitled to my advanced payment,Advance
1,to register my child for child_care assistance,Enquire_CCB
1,reporting family income,Update_FamilyIncomeEstimate
1,the amount of my payment,Check_Payments
4,family assistance enquiries,Enquire_FamilyAssistance
1,jet child_care assistance,Enquire_Jet
1,i want to report my earnings report my earning,Report_Earnings
1,a claim form,Claim
1,family payment information,Enquire_Payments
1,to find out what child allowance we paid two year ago,PaySummary
1,the one_off bulk payment six hundred dollars per child,Enquire_LumpPayment
1,registering a new_born for medicare and centrelink,Claim
1,wondering when my family allowance was start again,Enquire_Payments
2,annual income,Update_FamilyIncomeEstimate
1,i didn't get paid my payment on friday,Enquire_Payments
1,to find out my partner's income for the last twelve months weeks,Report_Earnings
2,assets,Enquire_Payments
1,enquiring family assistance child_care benefit sorry,Enquire_CCB
2,revise,Garbage
1,i need a statement showing the family assistant payments i receive,PaySummary
1,i'm carer of a child,Enquire_SharedCare
1,one_off payment,Enquire_LumpPayment
1,would like to find out entitlement of child_care benefit,Enquire_CCB
1,to update our income for the next financial year,Update_FamilyIncomeEstimate
1,recently separated,Change_Circumstances
5,account payable,Debt
1,i want to enquire about my parenting payment,Enquire_Parenting
1,regards to the baby bonus,Maternity
1,a query about the account statement for parenting payment,Enquire_Parenting
1,following following up of recent call,Respond_Correspondence
1,an operator please about single parents,Enquire_Parenting
1,living away from home allowance,YouthAllowance
1,to say i'm a non non tax year,TaxReturn
1,it's about my family assistant i got a letter and i need to ring you about family assistance offers guide to payments i've got to fill in a form,Enquire_FamilyAssistance
1,pay adjustment,Enquire_Payments
1,update my estimate and change of address,PersonalDetails
3,rent information,RentAssistance
1,to advise that i'm a non tax lodger,TaxReturn
2,sum payment,Enquire_LumpPayment
1,i want to know why i've been cut off,Enquire_Payments
1,to claim my child_care benefits for the financial year,Claim
1,advance payment family money,Advance
1,centrelink assessment,Assessment
1,estimate my income,Update_FamilyIncomeEstimate
1,family assistance a and b payment,Enquire_Payments
1,need to talk to a customer service due to a letter,Respond_Correspondence
1,health_care card problems,Cards
1,just wanting to know about my son's youth allowance where is he go from there when he's not studying,YouthAllowance
1,my money,Enquire_Payments
1,i want to know family tax benefit,Enquire_FTB
1,not declaring a tax return this year,TaxReturn
1,like to know when i can apply for advance payment,Advance
1,unemployment details,Employment
1,i come to check the result of my claim last week,Claim
1,enquiry to family tax payment family assistance,Enquire_FTB
1,application for parenting form,Claim
1,i want to locate the singleton number for the family assistance office,GeneralEnquiry
1,i just wanna talk to someone,Request_Operator
1,i want talking about the children if under sixteen if we got some money from the centrelink,Enquire_FamilyAssistance
1,change my family details,Enquire_FamilyAssistance
1,a report earning,Report_Earnings
