occurance,transcription,App_TAG
1,i wanna know what time centrelink opens and closes,GeneralEnquiry
1,tax payment enquiry,Enquire_Payments
1,have new_born payment for the newborns,Claim
1,to get my bank details,PersonalDetails
1,advance loan for parenting payment,Advance
1,i need to update my earning,Report_Earnings
4,report partner's income,Report_Earnings
2,jet payment,Enquire_Jet
8,about a payment,Check_Payments
1,my family allowance,Enquire_FamilyAssistance
1,my pay didn't go in my parenting payment,Enquire_Parenting
1,centrelink exemption to collect child support,ChildSupport
1,family amount,Enquire_FamilyAssistance
1,i have queries on completing my form to apply for family assistance,Enquire_FamilyAssistance
1,i'm going to put my child into child_care,Enquire_CCB
1,i need to a speak to operator please,Request_Operator
1,i need to find out about child_care benefits,Enquire_CCB
1,enquiries about the family supplement,Enquire_FamilyAssistance
1,questions relating to a rent certificate,RentAssistance
1,family assistance income credit,Enquire_FamilyAssistance
1,just get me a person,Request_Operator
1,letter i got in child_care benefit,Enquire_CCB
1,apply for payment,Claim
1,change my salary my pay and to inform you,Update_FamilyIncomeEstimate
1,i'm reporting my wage for the last couple of weeks i think i've got the right number,Report_Earnings
1,family family tax benefit advance,Advance
1,i think i'm being overpaid for parenting payment,Enquire_Parenting
1,need to cancel a payment,Enquire_Payments
1,for the housing house,RentAssistance
1,need to know what my payments are,Check_Payments
1,hear my payments,Check_Payments
1,guess a,Garbage
1,payment reporting,Report_Earnings
1,to notify that i do not have to put a tax return in,TaxReturn
1,parenting bonus payment,Enquire_Parenting
1,when will i receive my payments for my children,Enquire_LumpPayment
1,update yearly estimate income,Update_FamilyIncomeEstimate
1,i just need to speak to somebody,Request_Operator
1,speak to a parenting payment officer,Enquire_Parenting
1,my update yeah estimate,Update_FamilyIncomeEstimate
1,change of address and something else,PersonalDetails
1,family taxes,Enquire_FTB
1,i just need to report some changes,Change_Circumstances
1,family tax benefit entitlement,Enquire_FTB
1,jet funding,Enquire_Jet
1,i'm enquiring about the six hundred dollars on family payment,Enquire_LumpPayment
1,basically i got paid today and i didn't get the full amount of my money,Enquire_Payments
1,to change some of my details,PersonalDetails
1,need to speak to a customer service officer i got cut off,Request_Operator
1,change of payment income,Enquire_Payments
1,talk to an operator about my family payment,Enquire_FTB
1,i'm ringing about a friend of mine told me about advance payment that you can receive in january and july i'm just ringing about how it works,Advance
1,a change in details,PersonalDetails
1,sorry i do have a number,Enquire_Vague
1,no pay,Enquire_Payments
1,to register the service provider number for child_care,Enquire_CCB
1,update the hours of child_care benefit,Enquire_CCB
1,i wanna correct the name of my wife,PersonalDetails
1,to change your income,Update_FamilyIncomeEstimate
38,taxable income,PaySummary
1,change of child_care centre,Enquire_CCB
1,speaking to a customer service officer please,Request_Operator
1,i'm enquiring about jet child_care,Enquire_Jet
1,letter of suspension,Respond_Correspondence
1,i need customer service,Request_Operator
1,lump_sum advanced payment,Advance
34,customer service officer,Request_Operator
1,to adjust payments,Enquire_Payments
1,regarding school holiday school program over the holidays,Enquire_CCB
4,updating my income estimate,Update_FamilyIncomeEstimate
2,pension of parenting payment,Enquire_Parenting
1,minimum child_care benefit,Enquire_CCB
1,follow up on correspondence,Respond_Correspondence
1,a letter received regarding family tax benefits,Enquire_FTB
1,enquiry about family tax benefit payment,Enquire_FTB
1,change to child_care benefit,Enquire_CCB
121,family income,Update_FamilyIncomeEstimate
1,a don't have to lodge a tax return,TaxReturn
1,i just want to know about my payments please thank you,Check_Payments
2,change of family circumstances,Change_Circumstances
18,family assistance office,Enquire_FamilyAssistance
1,statement account,IncomeReportingStatement
1,once off advance,Advance
1,a statement with my family tax benefit and other benefits,Enquire_FTB
3,just general enquiry,Enquire_Vague
1,reference number,GeneralEnquiry
1,rent certificate information,RentAssistance
1,i want to see how i go about paying a bill out of my payments,Deductions
1,lump_sum first payment,Enquire_LumpPayment
1,well i haven't got one,Enquire_Vague
1,changing from work to study,Education
4,i need to speak to operator,Request_Operator
1,add a provider to the child_care benefit list,Enquire_CCB
1,my taxable income please,PaySummary
1,i would like to apply for the lump_sum advance payment for my family assistance,Advance
1,checked my payments,Check_Payments
1,family assistance assistance calendar,Enquire_FamilyAssistance
1,it's about family assistance tax family tax benefit,Enquire_FTB
1,it's about a letter i received regarding my family tax benefits for the two thousand and four oh five financial year,Enquire_FTB
1,house rental,RentAssistance
1,the six hundred dollar a child in july,Enquire_LumpPayment
1,want to speak with an operator,Request_Operator
1,new financial year i want to know how it's going to work,Enquire_FamilyAssistance
1,need to report some earnings,Report_Earnings
1,regarding yearly payment for children,Enquire_LumpPayment
1,find out how much i'm going to get paid,Check_Payments
1,declaring fortnightly earnings,Report_Earnings
1,child_care information,Enquire_CCB
1,no parenting payment in bank,Enquire_Parenting
1,my daughter has started school,Enquire_CCB
1,report for my earnings,Report_Earnings
1,to talk to operator,Request_Operator
1,help with registered care,Enquire_CCB
2,income and assets update,IncomeReportingStatement
1,want to ask a question,Enquire_Vague
1,i've got an appointment but can't remember if it's today or tomorrow,Appointment
1,to say that i did no work in the last financial year,Report_Earnings
1,internet page,Support_SelfService
31,income update,Update_FamilyIncomeEstimate
1,change child_care centre,Enquire_CCB
1,yearly statements,PaySummary
1,moved to australia and enquiring about what benefits we maybe able to receive,Overseas
1,parent income,Enquire_Parenting
4,want to update my income,Update_FamilyIncomeEstimate
1,to find out see if i get any money for for clothes for disability six hundred,Enquire_LumpPayment
1,i have a question regarding my husband's earnings,Report_Earnings
1,i was just speaking to customer service operator i was cut off,Request_Operator
1,wanna speak to an operator about my payment,Enquire_Payments
1,payment family assistance,Enquire_Payments
1,i got paid holiday pay and i'm getting paid centrelink money and i need to speak to somebody,Enquire_Payments
1,i want to see if i qualify for child_care benefits,Enquire_CCB
1,i want to talk to someone about some retrospective tax information,Enquire_Tax
1,me money,Enquire_Payments
2,debts,Debt
1,i'm calling in regards to the f_t_b payments,Enquire_FTB
1,what i want to know if there is an allowance for a stay at home mum,Enquire_FamilyAssistance
1,child_care hours family assistance,Enquire_CCB
1,enroll,Enquire_Vague
16,new_born child claim for family assistance and medicare,Claim
1,check a claim,Claim
1,change of the details,PersonalDetails
1,to get registered,Enquire_FamilyAssistance
1,i just wanted to know about that hundred dollars a child when would i receive it,Enquire_LumpPayment
36,update family estimate,Update_FamilyIncomeEstimate
1,amount that i earned in the fortnight,Report_Earnings
1,to check my payment amount,Check_Payments
1,pay benefit,Enquire_FamilyAssistance
1,apply for an interim pension card for health services medical care and to update my financial bank account,Cards
2,to report my partner's income,Report_Earnings
1,started work,Employment
1,for the family assistance to get the claim number,Claim
1,two thousand and six estimate,Update_FamilyIncomeEstimate
1,to claim the baby bonus,Claim
1,changing jobs,Employment
8,bank account details,PersonalDetails
1,holiday program,Enquire_CCB
1,separation details,Change_Circumstances
23,family tax advance,Advance
2,return,Garbage
1,family tax rebate for tax fund,ChildCareRebate
1,i have,Garbage
15,i need to update my family income estimate,Update_FamilyIncomeEstimate
1,i'd like to have employment,Employment
3,work hours,Report_Earnings
1,to make a claim for child_care,Enquire_CCB
1,i want to know when i receive receive the statement,IncomeReportingStatement
1,i wanna know what family allowance i get,Enquire_FamilyAssistance
1,i'm calling about immunizations and a bonus available,Immunisation
1,for my,Garbage
1,enquiring about disability six hundred dollars allowance,Enquire_LumpPayment
1,concession cards,Cards
1,child estimate wage earnings,Update_FamilyIncomeEstimate
1,to ask about the family assistance,Enquire_FamilyAssistance
1,to speak with someone,Request_Operator
1,regard to child_care benefit,Enquire_CCB
1,to find out the amount of the next payment,Check_Payments
3,low income health_care card,Cards
1,fix up family assistance amount,Enquire_FamilyAssistance
1,report income report,Report_Earnings
1,i don't need to do tax,TaxReturn
1,i'm calling about the annual payment for a chile i don't know what it's called,Enquire_Payments
1,it stops,Garbage
1,pay rate change,Enquire_Payments
1,my daughter is starting child_care,Enquire_CCB
1,i'm a student seeking benefits as a pensioner,Claim
1,want to change my child_care provider number,Enquire_CCB
1,regarding child support payments,ChildSupport
1,just talk to an operator,Request_Operator
1,to notify someone to have extra access,Enquire_SharedCare
1,just to let you know i don't have to put a tax return in,TaxReturn
1,increase in payment,Enquire_Payments
1,a payments,Enquire_Payments
2,tax number,Enquire_Tax
1,i want to change my pay_day,Enquire_Payments
1,i need to change my marital status,Change_Circumstances
1,to find out about that six hundred dollars per child,Enquire_LumpPayment
1,child immunization update,Immunisation
1,application for new_born child family assistance,Claim
1,to advice of change of percentage for child_care,Enquire_CCB
1,i need to find out my amount of pay due next tuesday,Check_Payments
1,the end of the year financial one_off payment of six hundred dollars,Enquire_LumpPayment
1,storm relief money,Announcement
1,i wanna find out what i'm getting in a future payments,Check_Payments
1,change income assessment,Update_FamilyIncomeEstimate
1,want to know why my son hasn't been paid a youth allowance,YouthAllowance
1,i need a claim form for family tax benefit part_b,Claim
2,to apply for an advance,Advance
3,for payment,Enquire_Payments
1,a letter about centrelink payment,Respond_Correspondence
1,query on family assistance,Enquire_FamilyAssistance
1,customer assisted claim to be ran,Claim
25,need to report earnings,Report_Earnings
2,i didn't receive a payment today,Enquire_Payments
1,payments for family assistance,Enquire_Payments
1,i need to add a child to my claim,Claim
1,support i need some support,Enquire_FamilyAssistance
12,i need to update my income estimate,Update_FamilyIncomeEstimate
1,just wanna speak to an operator,Request_Operator
36,child_care assistance,Enquire_CCB
1,put in my income for the fortnight,Report_Earnings
1,no idea,Enquire_Vague
1,i want to find out when my working credits begin,Enquire_Payments
1,family assistance application,Claim
1,i want to talk to a real person,Request_Operator
1,about the endowment,Enquire_FamilyAssistance
1,in reference to the family tax benefit part_a,Enquire_FTB
1,i receive a letter a letter today the updated family assistance because wait,Enquire_FamilyAssistance
1,i need to speak to somebody regarding family assistance,Enquire_FamilyAssistance
1,talk to somebody customer service,Request_Operator
1,rent payment,RentAssistance
1,payment summaries,PaySummary
1,reason for my call i wanna find out about some payments,Enquire_Payments
1,over_payments,Debt
1,want to stop payments fortnightly,Enquire_Payments
1,about a claim,Claim
1,lump_sum family payment,Enquire_LumpPayment
1,putting my children in day_care,Enquire_CCB
3,rent,RentAssistance
1,group certificate for tax purposes,PaySummary
1,a health_care card and money income,Cards
2,i need to update my family income earnings,Update_FamilyIncomeEstimate
1,the reason for my call i just wanted to ask few question about,Enquire_Vague
1,advance payments and enquiry about parenting payment form,Advance
3,talk to the operator,Request_Operator
1,centrelink has asked asked me to call,Respond_Correspondence
1,to give my income from my wife family payment,Enquire_Payments
4,to speak to the operator,Request_Operator
1,partner's payment,Enquire_Payments
1,query about application for payment forms,Enquire_Payments
1,the end of financial year six hundred dollar per child payment,Enquire_LumpPayment
1,enquiry on youth allowance claim,YouthAllowance
1,newstart claim,NewStart
1,my payments missing,Enquire_Payments
1,income threshold,Enquire_Earnings
1,family tax benefit through the tax system,Enquire_FTB
1,yearly yearly percentage income child_care benefits,Enquire_CCB
1,i need to know my yearly income,PaySummary
1,how much my wife received last year,PaySummary
4,report income,Report_Earnings
1,child_care out of school hours,Enquire_CCB
3,tax information,Enquire_Tax
1,the summary payment for the end of the month,Enquire_Payments
1,i need information about what forms to fill in for family assistance,Claim
1,change pay days,Enquire_Payments
1,okay i spoke to a young man the other day from centrelink i had an appointment last thursday but couple weeks ago he rang me he told me on the phone explained to me what the appointment was about and i didn't need to attend now that i spoken to him now i'm getting another letter that saying that they want me to attend so i don't,Appointment
1,my jet assistance,Enquire_Jet
1,i need to repair report my earnings,Report_Earnings
1,cancel my rent,RentAssistance
1,child_care forms,Enquire_CCB
1,i want to ask a question about what does parenting payment partners mean,Enquire_Parenting
1,what i have to do for tax,Enquire_Tax
1,i want to make my payments weekly,Enquire_Payments
1,find out how much is going into my account,Check_Payments
1,about the child_care benefits,Enquire_CCB
1,i have a query regarding family assistance for a child in my care,Enquire_FamilyAssistance
1,i have some queries about my payments so i would like to speak to the operator,Enquire_Payments
1,i'm calling about a parenting,Enquire_Parenting
2,claiming for new_born,Claim
1,to see if i have an appointment,Appointment
34,youth allowance,YouthAllowance
1,replying to a letter sent,Respond_Correspondence
2,assessment notice for child_care benefit for approved care,Enquire_CCB
1,tax benefit payment supposed to be due,Enquire_FTB
1,i just need to speak to an operator about an enquiry,Request_Operator
1,update circumstance,Change_Circumstances
1,most recent most recent payments,Check_Payments
1,i want to enquire about child_care benefits,Enquire_CCB
1,update my estimate estimated income,Update_FamilyIncomeEstimate
1,tax benefits part_a,Enquire_FTB
1,loan application not sure,Advance
3,self_service check my payments,Check_Payments
1,enquiry tax benefits,Enquire_Tax
1,update my family tax income,Update_FamilyIncomeEstimate
1,notify of travel overseas,Overseas
1,no money in my bank,Enquire_Payments
1,i want to update my family earning estimate,Update_FamilyIncomeEstimate
3,need to update,Update_FamilyIncomeEstimate
1,my regular payments,Check_Payments
1,change of figures,PersonalDetails
1,organize family payment,Enquire_Payments
1,to discuss income balance,Update_FamilyIncomeEstimate
1,lodgement of tax income tax return,TaxReturn
1,i'm ringing about my child_care benefit assessment,Enquire_CCB
1,requesting a loan,Advance
1,information on the new budget,Announcement
1,reinstating child_care benefit,Enquire_CCB
1,i want to update my family income statement,Update_FamilyIncomeEstimate
1,if i need to lodge a tax return,TaxReturn
1,gave birth to a child,Claim
1,cancellation or family assistance,Enquire_FamilyAssistance
1,reportable fringe benefit,Update_FamilyIncomeEstimate
1,regarding a letter i got sent,Respond_Correspondence
1,to check_up on my tax benefit b,Enquire_FTB
1,parenting payment partnered it still hasn't been you know looked at or whatever so i'm still on i need to speak to somebody please,Enquire_Parenting
1,it's to report family income and i wanna find out when i get paid for the children,Update_FamilyIncomeEstimate
4,report,Report_Earnings
1,i want to ask for my child location of child_care benefit,Enquire_CCB
1,six hundred dollar benefit for children,Enquire_LumpPayment
1,i'm after some information about single parents,Enquire_Parenting
1,check phone number,GeneralEnquiry
1,age pension,AgedRetirement
1,a stolen card,Cards
1,to find to find out about my family payment,Enquire_Payments
1,i put in a claim for a maternity payment and i was just wanting to check on the progress please,Claim
1,hours of child_care benefit,Enquire_CCB
2,find out about,Enquire_Vague
1,my payment isn't in my account,Enquire_Payments
1,i want to know about the six hundred dollars payment,Enquire_LumpPayment
1,it's a tax enquiry,Enquire_Tax
1,not all my pay was in the bank,Enquire_Payments
38,income statement,IncomeReportingStatement
1,to advise of non tax return lodgement,TaxReturn
1,to report my working hours,Report_Earnings
1,enquiry for application of for payment form for parenting payment,Enquire_Parenting
10,i want to report my earnings,Report_Earnings
1,update my estimate earnings,Update_FamilyIncomeEstimate
1,regarding a payment that wasn't put into my account,Enquire_Payments
1,i want to know about the child_care benefits,Enquire_CCB
2,application,Claim
1,just operator please,Request_Operator
1,i need some information about child_care allowance,Enquire_CCB
1,checking my family assistance if i've paid it off i've paid off my,Enquire_FamilyAssistance
2,child_care benefit for vacation care,Enquire_CCB
1,asking about disability payment,SicknessDisability
1,trying to report income,Report_Earnings
1,enquiring about carers allowance,Carers
1,regarding a,Enquire_Vague
3,my allowance,Enquire_Payments
1,pension income,Enquire_FamilyAssistance
1,enquiry to family payment no pension parenting payment sorry,Enquire_Parenting
1,report income employment employment income,Report_Earnings
10,family assistance letter,Enquire_FamilyAssistance
1,to some information,Enquire_Vague
1,to do with family tax benefit thank you,Enquire_FTB
1,to restart my payments,Enquire_Payments
1,enquiry about lump_sum july payment,Enquire_LumpPayment
1,payment not in,Enquire_Payments
4,carers allowance,Carers
1,to report someone some payments in the the person they're caring for is working,Fraud
1,i want to update my income please,Update_FamilyIncomeEstimate
1,general enquiry about income earnings income,Enquire_Earnings
1,reporting my earnings for the fortnight,Report_Earnings
1,accounts payable,Debt
1,enquire about a loan,Advance
4,changing bank details,PersonalDetails
1,cause i'm a non_lodger,TaxReturn
1,i'd like to speak to customer service,Request_Operator
1,earn,Enquire_Earnings
14,a family payment,Enquire_Payments
1,update my family tax,Enquire_FTB
1,to advise of an estimated income,Update_FamilyIncomeEstimate
1,can i just speak to an operator,Request_Operator
3,family assistance claim,Claim
1,advances in payment,Advance
1,check payment for next week,Check_Payments
1,enquiring about pay tomorrow,Check_Payments
1,to report a non return tax,TaxReturn
1,i just want to make an enquiry regarding my,Enquire_Vague
1,to get a pin,Support_SelfService
1,date of my payment,Check_Payments
1,suspension enquiry,Enquire_Payments
1,a deduction of rent,Deductions
1,i need my gross income amount for the last financial year,PaySummary
1,i want to ask about payment,Enquire_Payments
1,fortnightly employment update payment,Report_Earnings
1,it's my father he's in new zealand it's the only kind of relative that i have here in australia,Overseas
49,i need to report my earning,Report_Earnings
1,i need to speak to my local branch,GeneralEnquiry
1,find out when the payment summaries will be sent,PaySummary
1,to change,PersonalDetails
1,the letter i have received saying cancellation of your family assistance,Enquire_FamilyAssistance
1,i'm just interested if someone sent me out a statement for the tax so i can so it yeah thank you,PaySummary
1,help with group certificate,PaySummary
433,family tax benefit,Enquire_FTB
1,to check when the six hundred dollars per child is coming in,Enquire_LumpPayment
1,review of family tax benefit,Enquire_FTB
1,need to update family income,Update_FamilyIncomeEstimate
1,please speak to someone in family payments,Enquire_Payments
1,to speak with a customer service operator,Request_Operator
1,enquiry regarding child_care benefit percentage,Enquire_CCB
1,need talk to operator,Request_Operator
1,apply for the advance payment,Advance
1,service supplement,Enquire_FamilyAssistance
1,i need to change child_care centre,Enquire_CCB
1,my payment amount,Check_Payments
1,weekly income,Report_Earnings
1,need to find out some information,Enquire_Vague
1,regarding doing my tax return,TaxReturn
1,enquiry about carers entitlement for an invalid person,Carers
1,i wanna know about the pension payment plans the the payment that you're getting june or july the bonus the the pension bonus,GeneralBonus
1,about payments for bobby viteli,Enquire_Payments
1,to change my husband's income what he's earning for next this year,Update_FamilyIncomeEstimate
1,child_care rebate and baby bonus,ChildCareRebate
1,query on a claim,Claim
2,to change my family assistance payment,Enquire_FamilyAssistance
1,fortnight fortnightly earnings,Report_Earnings
1,i need to get a printout information sent out for tax reasons,PaySummary
1,one_off payments,Enquire_Payments
2,for family tax benefit,Enquire_FTB
1,need to know when payment is in,Check_Payments
4,reporting payment,Report_Earnings
1,about the pez,Education
1,answering a letter,Respond_Correspondence
2,update family assessment,Update_FamilyIncomeEstimate
1,for my daughter to report she's working,Enquire_FamilyAssistance
1,australian government lump_sum,Enquire_LumpPayment
2,about payment,Enquire_Payments
1,to find out about the payment for tax benefit,Check_Payments
1,change my partner's details for employment,Report_Earnings
1,it's may about the government bonus for my i didn't receive everybody did receive but i didn't receive,GeneralBonus
1,to give you my tax file number,PersonalDetails
1,what's my payment for this week,Check_Payments
1,report immunization,Immunisation
1,advance lump_sum payment,Advance
1,i want to update my family income payment,Update_FamilyIncomeEstimate
21,change in circumstances,Change_Circumstances
1,how much money went into my bank account today,Check_Payments
1,social family assistance,Enquire_FamilyAssistance
1,pensioner education payment,Education
1,need tax benefit,Enquire_FTB
1,i'd like to explore the family assistance,Enquire_FamilyAssistance
1,to find out about family allowance,Enquire_FamilyAssistance
7,about payment,Enquire_Payments
2,phone number,GeneralEnquiry
1,checks,Garbage
1,about a family allowance payment,Enquire_FamilyAssistance
1,payment in july,Enquire_LumpPayment
2,about my group certificate,PaySummary
1,notice request information under division one part,Respond_Correspondence
1,the family tax benefit six hundred dollars payment,Enquire_LumpPayment
1,i want to update my income for this two thousand and eight financial year,Update_FamilyIncomeEstimate
1,income family income estimate,Update_FamilyIncomeEstimate
1,didn't get paid family assistance,Enquire_FamilyAssistance
1,i would like to organize to stop working and get a job seeker i_d number,JobSeeking
1,my two children with the third of assistance last year i'm willing to let you know what their earnings have been this financial year,Enquire_FamilyAssistance
1,i'm trying to fill out the family assistance form,Claim
1,child_care benefit and maternity allowance payment enquiry,Enquire_CCB
1,change day of payment,Enquire_Payments
1,a query about my family assistant,Enquire_FamilyAssistance
1,haven't received payments,Enquire_Payments
1,computer access for family assistance,Support_SelfService
1,change my family tax benefit assessment,Update_FamilyIncomeEstimate
1,to update an assessment earnings,Report_Earnings
1,i'd like to find out how to register with centrelink,Claim
1,the new child_care benefit scheme that was brought out just enquiring about that,Enquire_CCB
1,query for payment form,Enquire_Payments
1,find out information about a traineeship,Education
1,change parenting payments,Enquire_Parenting
1,report date,Report_Earnings
1,form applications,IncomeReportingStatement
1,self_service menu check my payments,Check_Payments
1,account details for family assistance claim,Claim
1,to change my electricity account,Deductions
1,about my family allowance payment,Enquire_Payments
1,i'd like to see how much i was supposed to be paid today,Check_Payments
4,state income,Update_FamilyIncomeEstimate
1,report my earnings,Report_Earnings
1,i want to enroll my child in day_care and wanna know the percentage,Enquire_CCB
2,self,GoTo_SelfService
1,an enquiry about application for payment form,Enquire_Payments
1,talk to an assistant,Request_Operator
1,update family income benefit,Update_FamilyIncomeEstimate
1,put my hours in for work,Report_Earnings
1,my activation code,Support_SelfService
1,a discussion of parenting payment form,Enquire_Parenting
1,my child_care benefits,Enquire_CCB
1,reporting a change,Enquire_Payments
1,cancel parenting payment,Enquire_Parenting
