occurance,transcription,App_TAG
1,i want to know about child_care family tax assistance,Enquire_FTB
1,i need a customer service person,Request_Operator
1,if my daughter's put on our family assistant,Enquire_FamilyAssistance
1,i would like to check my future payments,Check_Payments
1,i thought i was getting the families advance,Advance
1,change pay_date,Enquire_Payments
1,to find out about immunization payment,Immunisation
1,because i need to speak to,Request_Operator
1,paying the lump_sum advance repayment,Advance
1,update my daughter's income estimate,Enquire_FamilyAssistance
1,once off yearly payment,Enquire_LumpPayment
1,update my family particulars thank you,Enquire_FTB
1,i handed in forms at medicare for my son's registered care and i have not received payment and that was on the twenty seventh of june,Enquire_CCB
1,update for estimate,Update_FamilyIncomeEstimate
1,out about a payment,Enquire_Payments
1,family tax credit enquiry,Enquire_FTB
1,a change in my earnings,Update_FamilyIncomeEstimate
1,i need to speak to michelle the lady i was speaking to this morning that's why i'm calling,GeneralEnquiry
2,payment info,Check_Payments
1,to talk to someone about my my tax,TaxReturn
3,need to speak to a operator,Request_Operator
1,the i don't know what you call it the bonus thing you get at tax time,GeneralBonus
1,see if i can get advance payment,Advance
1,find out tax benefit part e_a income,Enquire_FTB
1,to ask about payment,Check_Payments
1,to find out the amount i'm receiving tomorrow,Check_Payments
1,checking checking income for last financial year,PaySummary
1,about my payments bonus payments,GeneralBonus
19,i wanna speak to an operator,Request_Operator
1,baby immunization register,Immunisation
1,baby bonus payment oh,Maternity
1,checks bonus,GeneralBonus
1,flood assistance,Announcement
1,letters i received,Respond_Correspondence
1,renting,RentAssistance
1,to find out when we get our advance payments,Advance
1,to ask about a payment i received,Enquire_Payments
1,report increase in earnings,Report_Earnings
1,i need a group certificate for last year's tax,PaySummary
1,to talk to somebody about family assistance a lump_sum,Enquire_LumpPayment
1,need to repeat my my earnings,Report_Earnings
1,checking money,Check_Payments
1,getting paid,Check_Payments
1,the income is wrong on a letter i received today,Respond_Correspondence
1,internet account log_on,Support_SelfService
15,customer enquiry,Enquire_Vague
1,assistant payment update,Enquire_Payments
1,apply health_care card,Cards
1,i need confirmation of my payments,Check_Payments
1,my payment has been suspended,Enquire_Payments
1,family assistance i got a letter,Enquire_FamilyAssistance
1,the bonus parenting,Enquire_Parenting
1,just to enquire about my payment next week,Check_Payments
2,advance loans,Advance
1,i need to register for vacation care,Enquire_CCB
1,family assistance lump sums,Enquire_FamilyAssistance
1,reporting earn,Report_Earnings
1,shared care enquiry,Enquire_SharedCare
1,about a debt for my family assistance,Debt
1,to provide my bank account details and my family's australian residency status,PersonalDetails
1,review of family tax benefit for child turning sixteen,Enquire_FTB
1,you check want to check on my carers allowance claim,Carers
1,me and my partner are separating,Change_Circumstances
1,enquiry about family tax benefit advance,Advance
1,overseas,Overseas
1,medicare safety net,MedicareCard
1,i received some letters that i want to enquire about,Respond_Correspondence
2,i want to update my family income earning,Update_FamilyIncomeEstimate
1,last payments,Check_Payments
1,cancelling an appointment,Appointment
1,my year to date earnings,PaySummary
1,reporting gain,Report_Earnings
1,change of something,PersonalDetails
1,to state my taxable income,PaySummary
1,parenting payment one_off,Enquire_Parenting
1,tax returns information,TaxReturn
1,i need i need the family assistance put in early into my account i've got no money,Enquire_FamilyAssistance
4,change of address details,PersonalDetails
2,declare fortnightly income,Report_Earnings
1,want internet access,Support_SelfService
1,lump_sum payments family tax in july,Enquire_LumpPayment
1,starting a job,Employment
9,declare income,Report_Earnings
1,to do with an assessment notice,Assessment
1,to add a venue to my family assistance holiday program care,Enquire_CCB
1,dispute on parenting payment to newstart,Enquire_Parenting
1,it's about my earnings,Report_Earnings
2,update salary,Update_FamilyIncomeEstimate
1,update my income estimate for this year,Update_FamilyIncomeEstimate
1,change of wages for the next year,Update_FamilyIncomeEstimate
1,just enquiring about my account statement that i received,IncomeReportingStatement
1,enquiry about c_c_b percentage,Enquire_CCB
1,my family estimate,Update_FamilyIncomeEstimate
1,well my name's i lost lost me wallet the other day with the pension card and everything and i care care for my wife and i'm in brisbane and i want to get a new card please,Cards
1,check child_care application,Enquire_CCB
1,i have a child with disability and i want to find out what i'm entitled to,SicknessDisability
1,i have a enquiry about my payment for my family tax benefit part_a,Enquire_FTB
1,i need to speak to,Request_Operator
2,tax statements,PaySummary
1,replacement form,IncomeReportingStatement
1,on behalf of my mother,Enquire_FamilyAssistance
1,too many children on my account,PersonalDetails
1,to inform of tax,TaxReturn
1,want to find out how much money you're allowed to earn,Enquire_FTB
1,family bonus payments,GeneralBonus
7,update child_care,Enquire_CCB
1,change in school status,Enquire_FamilyAssistance
1,i received a letter family assistance letter,Enquire_FamilyAssistance
1,i need to get a q_something form to withdraw from my superannuation,IncomeReportingStatement
1,regarding my child_care benefit,Enquire_CCB
1,speak with,Request_Operator
1,direct payments,Deductions
11,update my details,PersonalDetails
1,i just wanna ask about the financial year bonus for the children that's all thank you,Enquire_LumpPayment
1,i want update my family estimate,Update_FamilyIncomeEstimate
1,i want to find out about the centrelink payment the make up pay,Enquire_Payments
1,i need to discuss child_care benefit,Enquire_CCB
1,one lump_sum payment your family assistance,Enquire_LumpPayment
1,the supplement money,Enquire_FamilyAssistance
1,i want to find out about the six hundred dollar payment family payment,Enquire_LumpPayment
1,to register my new_born,Claim
1,replace,Garbage
1,add a child_care provider number,Enquire_CCB
1,we just had a baby we're claiming the grant for the baby for the new_born child,Claim
1,to my operator,Request_Operator
1,to check on my pension,Check_Payments
9,just an enquiry,Enquire_Vague
1,to add a child_care provider,Enquire_CCB
1,i need something i need a operator,Request_Operator
1,i want to claim that i don't have to put in a tax return,TaxReturn
1,income details for tax benefit and child_care benefit,Update_FamilyIncomeEstimate
1,details of child_care agreement,Enquire_CCB
1,would like to speak to somebody in regards to family assistance,Enquire_FamilyAssistance
1,annual allowance,Enquire_LumpPayment
1,incorrect income estimate,Update_FamilyIncomeEstimate
1,future payment check my payment,Check_Payments
4,like to speak to an operator,Request_Operator
1,i have commenced casual employment,Employment
1,to speak to someone about child_care,Enquire_CCB
1,it's about my family tax benefit two thousand and five to six,Enquire_FTB
13,customer assistance,Request_Operator
1,i want to talk to operator please,Request_Operator
1,parenting payment stuff up,Enquire_Parenting
1,to add child_care centre,Enquire_CCB
1,payment option,Enquire_Payments
4,about family tax benefit,Enquire_FTB
1,a family assistance notice,Enquire_FamilyAssistance
1,i got a letter about my family assistance and i'm just wanting to check on it,Enquire_FamilyAssistance
1,tax being lodged,TaxReturn
1,want to know how much i get paid,Check_Payments
1,change a choice,Enquire_Payments
1,just a summary of payments,PaySummary
1,i'm not work on two weeks time,Employment
1,to claim new_born child and family assistance and medicare,Claim
1,enquire about something,Enquire_Vague
1,to adjust my fortnightly payment,Enquire_Payments
1,enquiry about application,Claim
2,query on parenting payment,Enquire_Parenting
1,change direct debit information,Deductions
1,i would like the paperwork sent out to fill in for the carers allowance for an over sixteen year old please,Carers
1,leaving the country for a short time,Overseas
2,making a claim,Claim
1,enquiring about future payments,Enquire_Payments
1,steps a loan,Advance
1,need to apply for advanced payment,Advance
1,my family tax benefit payment,Enquire_FTB
1,i'd like to know about getting some part time work,Employment
1,change child_care benefit details,Enquire_CCB
3,child_care fees,Enquire_CCB
2,cancel centre_pay,Deductions
1,yeah i just want to check about my payment if it's right or wrong,Check_Payments
1,register my child for a child_care service,Enquire_CCB
1,apply for the five hundred dollar and operator,Advance
1,about my taxable income,PaySummary
1,balance of account,Debt
1,i want to report our income family income,Update_FamilyIncomeEstimate
1,check my payments online,Check_Payments
2,family assistance lump_sum,Enquire_LumpPayment
1,re-estimating my income,Update_FamilyIncomeEstimate
1,query about amount being paid,Check_Payments
1,i want to update i want my family assistance office number,Enquire_FamilyAssistance
4,income enquiry,Enquire_Earnings
1,i need to hand in a family assistance form,Enquire_FamilyAssistance
2,i want to talk to somebody,Request_Operator
1,the large family supplement,Enquire_FamilyAssistance
1,i'm studying i started studying,Education
1,retirement,AgedRetirement
2,general query,Enquire_Vague
1,my family assistant payment,Enquire_Payments
1,a q_two_three_oh letter,IncomeReportingStatement
1,checking on child_care benefit please,Enquire_CCB
1,loan in advance payment,Advance
1,send out payment summary,PaySummary
1,to apply for parenting,Claim
1,need to report my earnings earnings hello,Report_Earnings
1,i just need some assistance i've getting some child support for one of my children,ChildSupport
3,tax money,Enquire_FamilyAssistance
1,my i need to know about my payment my family payment,Enquire_Payments
28,update earnings,Report_Earnings
1,i wanna claim for youth allowance,YouthAllowance
1,i'm enquiring about what happens when my six when my granddaughter turn sixteen and are going to newstart allowance,NewStart
23,family estimate,Update_FamilyIncomeEstimate
1,to check family assistance payments,Check_Payments
1,i need to register with centrelink,Claim
1,defer family assistant payment,Enquire_FamilyAssistance
5,payment summaries,PaySummary
1,like to know more about how to what is the requirement for getting a health_care card and low income card and what is the amount which is called low income i'd like to know that,Cards
1,to make an enquiry,Enquire_Vague
1,children's disability payment,SicknessDisability
1,not doing a tax this year,TaxReturn
1,i'm calling to change the preventative care between me and my ex_partner of our children,Enquire_SharedCare
1,to discuss payments,Enquire_Payments
1,updating child_care centre number,Enquire_CCB
1,i have to finding how much i've earned,PaySummary
1,my partner's leaving and therefore i have a spouse to pay living with me,Change_Circumstances
1,my child_care benefit doesn't match,Enquire_CCB
1,to report on tax a tax b,Enquire_FTB
2,six hundred dollar advance,Enquire_LumpPayment
4,for family assistance,Enquire_FamilyAssistance
90,rent assistance,RentAssistance
1,i need to get some allowance back,Enquire_Payments
5,income assessment,Update_FamilyIncomeEstimate
1,work has changed,Employment
1,to hard,Garbage
1,family tax assistance,Enquire_FTB
6,submit earnings,Report_Earnings
1,i need to ask about applying for parenting payment partnered,Claim
1,receiving a letter from centrelink need to change,Respond_Correspondence
1,i need to obtain a copy of my family assistance statement,PaySummary
1,i want to speak to a social worker,GeneralEnquiry
1,my money hasn't gone into my account,Enquire_Payments
11,new baby,Claim
1,want to start up payments again,Enquire_Payments
1,i need to talk about my family tax benefit,Enquire_FTB
1,enquiry about some job carers and family assistance matter,Carers
1,didn't receive a family assistance payment today,Enquire_Payments
38,payment enquiries,Enquire_Payments
1,find out information about forms,IncomeReportingStatement
4,a health_care card,Cards
1,trouble with online access,Support_SelfService
1,change of living circumstance,Change_Circumstances
6,help,Enquire_Vague
1,i want a statement,IncomeReportingStatement
1,my benefit,Enquire_Payments
1,rental subsidy,RentAssistance
1,family tax payment for a child,Enquire_FTB
1,to check_up on new form applied,IncomeReportingStatement
1,update my address and also my husband's income estimate,PersonalDetails
1,find out address of family assistance office in bondi junction,GeneralEnquiry
1,i want to speak to an operator thank you,Request_Operator
1,i want to claim parenting payments,Claim
1,want to change my payment details,Enquire_Payments
1,enquiring about upfront payment,Advance
1,change of address statement of benefit,PersonalDetails
1,i'm using a new child_care centre,Enquire_CCB
1,in regards of a payment,Enquire_Payments
29,family tax benefit payment,Enquire_FTB
1,to get a pin for the internet,Support_SelfService
1,applying for the family tax benefit,Claim
1,like to report my earnings,Report_Earnings
1,job seeker i_d,JobSeeking
1,i need to provide a provider number,Enquire_CCB
1,child_care payment team please,Enquire_CCB
1,about family tax payment,Enquire_FTB
1,i'm applying for a loan,Advance
1,to add another carer,Enquire_CCB
1,need to tell no tax,TaxReturn
1,i wanna talk to a customer officer about a tafe course,Education
1,information of the thirty percent rebate child_care,ChildCareRebate
1,check the status on my maternity payment,Maternity
1,serve,Garbage
1,to fix my earnings,Report_Earnings
1,i need to update my family earnings,Update_FamilyIncomeEstimate
3,advance payment details,Advance
1,i received a letter today for the child_care benefit percentage my son is now at school not at preschool anymore just advising that he's not not at the preschool anymore he's at school,Enquire_CCB
1,to apply for the supplement,Enquire_FamilyAssistance
1,new child registration,Claim
1,taxable income received,PaySummary
1,claim enquiry,Claim
1,faxing a form,IncomeReportingStatement
1,i just wanna know how much i'm gonna get today for my little girl,Check_Payments
1,income yearly income report,Update_FamilyIncomeEstimate
1,date my assets,Enquire_Payments
1,i want the family tax benefit advance,Advance
2,customer service officer please,Request_Operator
1,to see that my tax return has been processed,TaxReturn
1,the carers allowance,Carers
1,i need to talk to somebody about tax return,TaxReturn
1,i want to find out what the full payment was for my family payment,TaxReturn
1,my pay didn't go into my bank fully,Enquire_Payments
1,i wanna update my family income estimate,Update_FamilyIncomeEstimate
1,new child new_born bonus thank you,Enquire_CCB
1,i need to change carer custody,Enquire_CCB
5,after_school care,Enquire_CCB
1,a tax,Enquire_Tax
1,wish to speak to an operator,Request_Operator
1,about the bonus we get for the children bonus,Enquire_LumpPayment
1,just to say i don't have to put a tax return in,TaxReturn
1,i need to report some earnings,Report_Earnings
2,applying for parenting payment,Claim
1,access,Enquire_Vague
1,i was wondering if the family assistance bonus for six hundred dollars,Enquire_LumpPayment
1,i want to know exactly what my account payable is,Debt
1,family tax payment enquiry,Enquire_FTB
1,enquiring about income,Enquire_Earnings
3,find out about payment,Check_Payments
1,i wanna find out when i'm being paid my family,Check_Payments
1,advancement on child payment,Advance
1,enquiring about my family tax,Enquire_FTB
1,family income benefit update,Update_FamilyIncomeEstimate
3,family child_care,Enquire_CCB
1,enquiry family payment,Enquire_Payments
1,account details for security says centrelink payments,PersonalDetails
1,i need to report to,Report_Earnings
1,find out for my bonus money,GeneralBonus
1,a child_care rebate,ChildCareRebate
2,to find out how much i'm getting paid,Check_Payments
5,to speak to someone,Request_Operator
1,i'm wondering about the family payment,Enquire_Payments
6,a letter i received,Respond_Correspondence
1,need to ask about a payment,Enquire_Payments
1,filling in a form,IncomeReportingStatement
1,exceptional circumstances claim,Change_Circumstances
1,i need to talk to someone about my shared care,Enquire_SharedCare
1,group certificate and parenting bonus,PaySummary
1,i've been suspended on the internet,Support_SelfService
3,child benefit,Enquire_CCB
1,yeah i want to see the update,Update_FamilyIncomeEstimate
1,alter family assist payment,Enquire_Payments
1,a loan advance loan,Advance
1,new bonus,GeneralBonus
1,i would like to discuss with an operator work for the dole program,Employment
1,changing bank account,PersonalDetails
1,assistance for child_care,Enquire_CCB
1,enrollment form for college vacation care,Enquire_CCB
1,wanna find out about my five hundred dollar loan,Advance
1,and i wanna find out what i'm getting next week from the family,Check_Payments
1,my spouse's income,Update_FamilyIncomeEstimate
1,i need to report my new income,Report_Earnings
1,clearing parenting payment cancellation,Enquire_Parenting
1,a query of my family assistance payment,Enquire_Payments
1,finding out why my payment was not put into the bank,Enquire_Payments
2,for an advance,Advance
1,cancellation of parenting payments,Enquire_Parenting
1,kindy provider number,Enquire_CCB
1,got a letter here that i want to speak to someone about,Respond_Correspondence
1,family advance payments,Advance
2,about my family tax benefit payment,Enquire_FTB
2,application for parenting payment,Claim
1,i want to know my child_care benefit,Enquire_CCB
1,bonus claim,GeneralBonus
1,baby bonus application lodgement,Maternity
2,government grant,Enquire_FamilyAssistance
1,i want to know my payment information,Check_Payments
2,report hours,Report_Earnings
1,i'm after the family assistance line to see whenever i'm getting paid for this single child,Enquire_FamilyAssistance
1,register my children with vacation care,Enquire_CCB
1,stop family payments,Enquire_FamilyAssistance
2,i need to update my assets,Enquire_Payments
1,lawrence,Garbage
1,my husband has received a pay rise,Update_FamilyIncomeEstimate
1,didn't get paid pension today,Enquire_Payments
1,to say i don't have to lodge a tax return,TaxReturn
1,c_c_r payment,ChildCareRebate
1,register for after_school care,Enquire_CCB
1,change account numbers,PersonalDetails
2,talk to a consultant,Request_Operator
1,do i need to report my earnings,Report_Earnings
1,payment relations,Enquire_Payments
1,i beg your pardon,Enquire_Vague
1,not paying tax,Enquire_Tax
2,speak to a customer service please,Request_Operator
1,taxation papers,Enquire_Tax
1,a family tax,Enquire_FTB
1,i just wanna enquire about the c_c_t_r,ChildCareRebate
1,need to update my income,Update_FamilyIncomeEstimate
1,i'm just calling up about a query about i've got a debit on my family assistance and i want i wanted to raise just the amount of my family assistance i mean my yearly income total,Debt
8,family advance payment,Advance
1,enquiry on family assistance letter,Enquire_FamilyAssistance
1,information on capital gains tax and pension payment,Enquire_Tax
4,family assistance estimate,Update_FamilyIncomeEstimate
1,reduction in family assistance,Enquire_FamilyAssistance
1,i need to talk to somebody about child_care benefit,Enquire_CCB
1,immunization payment for a child,Immunisation
1,i need help with tax,Enquire_Tax
1,i wanna get a higher access level on the online online services,Support_SelfService
1,tax purposes baby bonus,Maternity
1,i just want to update my child immunization history statement,Immunisation
3,advanced loan,Advance
1,query on letter sent today,Respond_Correspondence
1,i need to let you know that i've i've left my husband,Change_Circumstances
1,rent assistance cut off,RentAssistance
1,the payment details,Check_Payments
3,tax return non lodgement,TaxReturn
1,enquiries about family allowance,Enquire_FamilyAssistance
1,i am calling in relation to the family tax benefit,Enquire_FTB
1,in for new_born child claim for family assistance and medicare,Claim
1,the for letter for assessment for child_care benefit,Enquire_CCB
1,enquiry on carers pension,Carers
1,i'm seeking work need some assistance,Employment
1,checking enquiry,Enquire_Vague
1,i want to know if i'm eligible for a child_care benefit,Claim
4,update family tax benefit,Enquire_FTB
1,can't find my card,Cards
5,single parent pension,Enquire_Parenting
1,i need help fill out the family tax benefit,Enquire_FTB
2,i need to report something,Report_Earnings
2,i need to check my payments,Check_Payments
1,ringing up about my pay,Check_Payments
1,i want to do a number,Enquire_Vague
1,i think you missed one child on my assessment benefit,Assessment
1,self_service facilities,GoTo_SelfService
1,report my wages,Report_Earnings
2,operator assistance please,Request_Operator
1,i want to report report my earnings,Report_Earnings
7,change bank account,PersonalDetails
1,reclaim for parenting payment,Claim
1,earned income,Report_Earnings
1,to see when i'm going my lump_sum,Enquire_LumpPayment
1,replacement centrelink card,Cards
1,i have an enquiry about disability support,SicknessDisability
1,just to talk to a operator,Request_Operator
1,apply for a lump_sum advance,Advance
1,family assistance confirmation,Enquire_FamilyAssistance
1,payment adjustment,Enquire_Payments
1,finding out about thirty percent child_care tax rebate,ChildCareRebate
1,calling about the family lump_sum payment,Enquire_LumpPayment
1,cause i missed an appointment i need to make a new one,Appointment
1,enquiry for one_off payment,Enquire_Payments
3,change estimate,Update_FamilyIncomeEstimate
1,to sort out the income tax tax and family tax part_b,Enquire_FTB
1,claim for family assistance new_born child,Claim
1,i want to find out about a newstart allowance,NewStart
1,i need to report my,Report_Earnings
1,unpaid debt,Debt
1,change of employment details,Employment
1,to know about when i'll get six hundred dollars,Enquire_LumpPayment
1,i changed my thing to payment to not to get in the thing in the same,Enquire_FamilyAssistance
1,check on my parenting payment,Check_Payments
1,my tax return,TaxReturn
1,i want to know right of family payment and parenting payment,TaxReturn
1,declare my earnings,Report_Earnings
18,fortnightly income,Report_Earnings
1,children's day_care,Enquire_CCB
1,pertain,Garbage
1,i want to update my family income estimate for payments,Update_FamilyIncomeEstimate
7,change income estimate,Update_FamilyIncomeEstimate
1,i want to cancel my payments,Enquire_Payments
1,family bonus earning bonus,GeneralBonus
1,want to change where my son goes to child_care,Enquire_CCB
1,fortnightly report in,Report_Earnings
1,i need to to explain me the letter for assessment notice for child care benefit,Enquire_CCB
1,new pension card,Cards
1,family assistance for child_care benefits,Enquire_CCB
1,about advance payment,Advance
1,i need some clarification for my health_care card,Cards
1,sickness benefit,SicknessDisability
1,i wanna find out about the lump_sum payment six hundred dollar a child,Enquire_LumpPayment
4,jet,Enquire_Jet
3,change appointment time,Appointment
1,rental advice,RentAssistance
1,i don't have to do a tax return,TaxReturn
1,self_service loan,Advance
1,it's just an enquiry,Enquire_Vague
1,i have to speak to an operator about my payments,Enquire_Payments
1,i'd like to talk to an operator please,Request_Operator
1,information about form sent,Respond_Correspondence
1,i just wanted to know when my next payment is,Check_Payments
1,i need the records of my child_care benefits received and child_care benefits incurred,Enquire_CCB
1,i am ringing for a group certificate,PaySummary
77,check payments,Check_Payments
2,child_care benefit for registered care,Enquire_CCB
1,report my earning,Report_Earnings
1,to find out about my lump_sum and my baby money,Enquire_LumpPayment
1,want to update my family estimate,Update_FamilyIncomeEstimate
1,to find out if i need to lodge a tax return,TaxReturn
1,i really don't know,Enquire_Vague
2,claim for family assistance and medicare,Claim
1,i want to know how much i'm getting paid,Check_Payments
2,parent information,Enquire_Parenting
1,family income assessment,Update_FamilyIncomeEstimate
2,amount of next payment,Check_Payments
2,i want to know when the family tax benefit will be paid,Enquire_FTB
1,enquire about the carer payment,Carers
1,i need to speak to someone about a letter,Respond_Correspondence
1,reinstate my family assistance,Enquire_FamilyAssistance
1,government housing,RentAssistance
1,just wondering when we're entitled to the six hundred dollars each per child,Enquire_LumpPayment
1,wanting to adjust my child support,ChildSupport
1,to find out about the lump_sum payment,Enquire_LumpPayment
4,child rebate,ChildCareRebate
1,when the payments are going to be put into the bank,Check_Payments
1,just enquiring about my child's payments,Enquire_Payments
1,on loan claim,Advance
1,lodging claim,Claim
1,to apply for,Enquire_Vague
1,putting my children in vacation care,Enquire_CCB
1,eighteen hundred and fifty dollar advance,Advance
1,pension parenting pension,Enquire_Parenting
1,estimate tax,Update_FamilyIncomeEstimate
1,i want to apply for a pin number please,Support_SelfService
1,child_care rebate report,ChildCareRebate
1,claims and youth allowance,YouthAllowance
1,estimate and forms,Update_FamilyIncomeEstimate
1,cancellation of my family assistance,Enquire_FamilyAssistance
